{"$id":"QK_GBFP8_HEAD64_GRANULARITY_SWEEP_EXECUTION_V19_EXACTLY_ONCE_V18_BINDING_FRESH_L2_ACCEPTANCE_SCHEMA","$schema":"https://json-schema.org/draft/2020-12/schema","additionalProperties":false,"properties":{"acceptance_sha256":{"pattern":"^[0-9a-f]{64}$","type":"string"},"accepted":{"const":true},"action_id":{"const":"ace2:qk-gbfp8-base-v19:execute-once:fdfc33a1:additive-0001"},"artifact_kind":{"const":"qk_gbfp8_head64_granularity_sweep_execution_v19_exactly_once_v18_binding_fresh_l2_static_acceptance"},"binding_table_file_sha256":{"const":"87ab3deb25f77d89b0797d72004b4436f9541987da13a42f44a2bff7f9fa9655"},"claim_boundary":{"const":"STATIC_ONLY_NO_EXECUTION_AUTHORITY"},"decision":{"const":"ACCEPT_STATIC_PACKAGE"},"execution_package_file_sha256":{"pattern":"^[0-9a-f]{64}$","type":"string"},"fixture_report_file_sha256":{"pattern":"^[0-9a-f]{64}$","type":"string"},"official_payload_open_count":{"const":0},"official_target_process_starts":{"const":0},"required_disposition":{"const":"V19_EXACTLY_ONCE_V18_BINDING_STATIC_PACKAGE_READY_FOR_FRESH_L2_NO_EXECUTION_AUTHORITY"},"reviewer_role":{"const":"Fresh-L2"},"runtime_namespace_file_count":{"const":0},"static_acceptance_grants_execution_authority":{"const":false},"v18_acceptance_file_sha256":{"const":"342ab0130d7e132e4e288b9fa349f7e0c5efb87cb35f29cdbc86e3bc3f5e8cf2"},"v18_manifest_file_sha256":{"const":"fdfc33a1443f237fbaca882b13fb977ae3c2ad7f61e427453297d0621f4445c8"},"v19_executed":{"const":false}},"required":["acceptance_sha256","accepted","action_id","artifact_kind","binding_table_file_sha256","claim_boundary","decision","execution_package_file_sha256","fixture_report_file_sha256","official_payload_open_count","official_target_process_starts","required_disposition","reviewer_role","runtime_namespace_file_count","static_acceptance_grants_execution_authority","v18_acceptance_file_sha256","v18_manifest_file_sha256","v19_executed"],"type":"object"}
