{"acceptance_sha256":"ce5335e04487695fa1e3bd8ed1f5ab853b6790e2c901876b5408f5e5d194108f","accepted":true,"action_id":"ace2:qk-gbfp8-base-v19:execute-once:fdfc33a1:additive-0001","artifact_kind":"qk_gbfp8_head64_granularity_sweep_execution_v19_exactly_once_v18_binding_fresh_l2_static_acceptance","binding_table_file_sha256":"87ab3deb25f77d89b0797d72004b4436f9541987da13a42f44a2bff7f9fa9655","claim_boundary":"STATIC_ONLY_NO_EXECUTION_AUTHORITY","decision":"ACCEPT_STATIC_PACKAGE","execution_package_file_sha256":"0f897a5af0b7305aa771f5c660a0ca6b94e3343b8edee72707a3f90aeebb5bca","fixture_report_file_sha256":"3c980edc2d4195f8dac330e6463f9f23bc8b7d756c84cef0399a13f67a13d613","official_payload_open_count":0,"official_target_process_starts":0,"required_disposition":"V19_EXACTLY_ONCE_V18_BINDING_STATIC_PACKAGE_READY_FOR_FRESH_L2_NO_EXECUTION_AUTHORITY","reviewer_role":"Fresh-L2","runtime_namespace_file_count":0,"static_acceptance_grants_execution_authority":false,"v18_acceptance_file_sha256":"342ab0130d7e132e4e288b9fa349f7e0c5efb87cb35f29cdbc86e3bc3f5e8cf2","v18_manifest_file_sha256":"fdfc33a1443f237fbaca882b13fb977ae3c2ad7f61e427453297d0621f4445c8","v19_executed":false}
